title;href;price;description;imgPrincp;img1;img2;img3;img4;img5;img6
Echo Dot (5ª generación);https://amzn.to/4eGgKWn;64;Es un altavoz inteligente con una calidad de sonido espectacular. Se puede vincular a Alexa y tiene funciones de alarma, recordatorios, reproductor de música... Es el último de su generación y se puede controlar con el móvil.Nosotros lo recomendamos debido a su gran variedad de usos y su compatibilidad para poder domotizar tu casa, sin duda es un aparato super útil en todas las casas.;/productos/echo/echo-1 - ampliada.png;/productos/echo/echo-1.png;/productos/echo/echo-2.png;/productos/echo/echo-3.png;/productos/echo/echo-4.png;;
Kit de entrenamiento de tenis portátil;https://amzn.to/3Zo8R2d;17; Es un juego ideal para los amantes del tenis ya que puedes entrenar sin necesidad de tener un gran espacio para ello. Este juego te ayuda a agudizar tus habilidades y reflejos y te será super útil para mejorar y ganar a todos!!;/productos/kit_tenis/kit_tenis-5.png;/productos/kit_tenis/kit_tenis-1.png;/productos/kit_tenis/kit_tenis-2.png;/productos/kit_tenis/kit_tenis-3.png;/productos/kit_tenis/kit_tenis-4.png;/productos/kit_tenis/kit_tenis-6.png;/productos/kit_tenis/kit_tenis-7.png
Saco de boxeo de pie;https://amzn.to/4giFtkO;45;Es un saco enganchado en el suelo ideal para entrenar sin molestar a nadie. Este saco es ideal para los que quieren tener un saco en su casa pero no quieren ponerse a hacer agujeros en sus techos. Yo recomiendo mucho este saco por estas cosas y además porque mejoras un montón la coordinación, la agilidad..;/productos/saco_boxeo/saco_boxeo-agrandada.png;/productos/saco_boxeo/saco_boxeo-1.png;/productos/saco_boxeo/saco_boxeo-2.png;/productos/saco_boxeo/saco_boxeo-3.png;/productos/saco_boxeo/saco_boxeo-4.png;;
Soporte para bici;https://amzn.to/41nzfvE;20;Soporte para la bicicleta, te permite ahorrar espacio y moverlas para la mejor maniobras de ellas. Este producto es ideal para los que tienen bicis y se pelean por guardarlas de la manera que ocupe menos espacio. Además es más barato que el otro, pero de la misma calidad.;/productos/soporte_bicicleta_barato/Soporte_bicicleta_barato-agrandado.png;/productos/soporte_bicicleta_barato/Soporte_bicicleta_barato-1.png;/productos/soporte_bicicleta_barato/Soporte_bicicleta_barato-2.png;/productos/soporte_bicicleta_barato/Soporte_bicicleta_barato-3.png;/productos/soporte_bicicleta_barato/Soporte_bicicleta_barato-4.png;;
Soporte para bici;https://amzn.to/4foxd21;90;Soporte para la bicicleta, te permite ahorrar espacio y moverlas para la mejor maniobras de ellas. Este producto es ideal para los que tienen bicis y se pelean por guardarlas de la manera que ocupe menos espacio.Es un poco caro, pero tiene una calidad-precio muy buena y es un producto duradero.;/productos/soporte_bicicleta_caro/soporte_bicilceta_caro-agrandado.png;/productos/soporte_bicicleta_caro/soporte_bicilceta_caro-1.png;/productos/soporte_bicicleta_caro/soporte_bicilceta_caro-2.png;/productos/soporte_bicicleta_caro/soporte_bicilceta_caro-3.png;;;
Mando compatible con pro-controller;https://amzn.to/3Q435OQ;25;Mando de videojuegos, parecido al pro controller de Nintendo. Nosotros lo tenemos y es compatible con Swich, wii y pc. Ergónómico y muy cómodo, tiene bluetooth y conexión por cable usb. Con él, pudes jugar a toda clase de videojuegos. Lo recomendamos muy bien.;/productos/mando_procontroler/mando_procontroler-agrandado.jpg;/productos/mando_procontroler/mando_procontroler-1.jpg;/productos/mando_procontroler/mando_procontroler-2.jpg;/productos/mando_procontroler/mando_procontroler-3.jpg;/productos/mando_procontroler/mando_pro_controler-4.jpg;;
Pistola de masaje muscular;https://amzn.to/4igz0s0;20 - 30;Gran pistola de masaje que te permite relajar y descargar todo tu cuerpo. El kit incluye la pistola de masaje con 20 niveles de potencia, 6 cabezales que masajean diferentes partes del cuerpo (incluye manual detallado de los cabezales), cargador y un estuche reforzado para guardar todo, protegerlo y poder llevártelo a cualquier lado. Este producto es muy recomendable para todas las personas, ya realizes mucho deporte o ninguno, ya que muchos estudios han revelado que el relajar tu cuerpo semanalmente, ya sea con un masaje o con esta maravillosa pistola mejora tu eficiencia y bienestar diario y hace que te levantes diariamente con más energía y relajado. ¿Y qué prefieres?, gastarte un pastizal por una sesión de masaje o comprarte esta pistola de masaje por un precio más barato y poder pasártela cuando quieras y desde la comodidad de estar en tu casa y tumbado, sin necesidad de depender de alguien.;/productos/pistola_masaje/pistola_masaje-agrandada.png;/productos/pistola_masaje/pistola_masaje-1.jpg;/productos/pistola_masaje/pistola_masaje-2.jpg;/productos/pistola_masaje/pistola_masaje-3.jpg;/productos/pistola_masaje/pistola_masaje-4.jpg;;
Batería portátil magnética;https://amzn.to/4kMq7bs;50;Esta batería portátil de 10000mAh compatible con carga magnética/inalámbrica es perfecta para cargar tu móvil (iPhone sobre todo) sin necesidad de utilizar cable y sin necesidad de tener la batería suelta y separada del móvil, ya que gracias a esta batería, tu móvil y la batería estarán unidos mediante imanes y te permitirán ahorrar en espacio y darte más comodidad. No te preocupes si tu móvil no soporta la carga inalámbrica porque la batería también dispone de salida tipo C o tipo USB para que puedas cargar tu móvil sin ningún problema. Alguna característica de la batería a tener en cuenta es que te permite la carga de hasta  2 dispositivos a la vez, la batería proporciona 22W con carga por cable y 15W con carga inalámbrica lo que es igual a cargar un 50% de la batería de un móvil bueno en tan solo 30 minutos, otro punto a favor es que pesa tan solo 200g y mide poco más que la mitad de un móvil haciéndola super cómoda de transportar. Por estas razones, esta batería es perfecta para cargar tu móvil rápidamente cuando no dispones de un enchufe. El precio ronda los 50 euros y si te interesa alguna batería más sencilla y barata pero con características parecidas, escríbenos al correo de contacto y te aconsejaremos sobre otra y te diremos características, pros, contras...;/productos/bateria_portatil/bateria_portatil-agrandada.jpg;/productos/bateria_portatil/bateria_portatil-1.jpg;/productos/bateria_portatil/bateria_portatil-2.jpg;/productos/bateria_portatil/bateria_portatil-3.jpg;/productos/bateria_portatil/bateria_portatil-4.jpg;;
Cepillo eléctrico para la limpieza;https://amzn.to/4iDrmI2;25;Si las tareas de limpieza te resultan pesadas o simplemente quieres ahorrar tiempo y esfuerzo, este cepillo eléctrico de limpieza es la herramienta perfecta para ti. Este, incluye 7 cabezales con los que podrás limpiar desde azulejos y suelos hasta el baño, la cocina o incluso tu coche, sin necesidad de frotar con fuerza. Gracias a su mango ajustable podrás alcanzar rincones difíciles sin agacharte ni forzar la espalda. Además, su sistema eléctrico hace el trabajo pesado por ti, eliminando la suciedad incrustada en segundos. Este producto es perfecto para poder conseguir una mayor comodidad, higiene y, sobre todo, tiempo libre. Y algún dato acerca de él, es que dura hasta una hora seguida de limpieza y tarda tan solo 3 horas en cargarse por completo, las cuales podrás dedicar pasando tiempo en tus cosas y no limpiando.;/productos/cepillo_de_limpieza/cepillo_de_limpieza-agrandada.jpg;/productos/cepillo_de_limpieza/cepillo_de_limpieza-1.jpg;/productos/cepillo_de_limpieza/cepillo_de_limpieza-2.jpg;/productos/cepillo_de_limpieza/cepillo_de_limpieza-3.jpg;/productos/cepillo_de_limpieza/cepillo_de_limpieza-4.jpg;;
